{
    "$schema": "http://json-schema.org/draft-07/schema#",
    "$id": "https://ofn.gov.cz/vstupné/draft/schémata/časová-platnost.json",
    "type": "array",
    "title": "Časová platnost",
    "items": {
        "$id": "#/items",
        "type": "object",
        "title": "Časová platnost",
        "properties": {
            
            "vznik_časové_platnosti": {
                "$ref": "https://ofn.gov.cz/základní-datové-typy/draft/schémata/časový-okamžik.json"
            },
            "ukončení_časové_platnosti": {
                "$ref": "https://ofn.gov.cz/základní-datové-typy/draft/schémata/časový-okamžik.json"
            },
            "poslední_změna_platnosti": {
                "$ref": "https://ofn.gov.cz/základní-datové-typy/draft/schémata/časový-okamžik.json"
            },
            "časový_interval": {
                "type": "array",
                "items": {
                    "$ref": "https://ofn.gov.cz/základní-datové-typy/draft/schémata/časový-interval.json"
                }
	    },
            "časová_opakovatelnost": {
                "type": "array",
                "items": {
                    "type": "string"
                }
	    }
        }
    }
}

