[{
    "vznik_časové_platnosti": {
        "datum_a_čas": "2019-09-20T09:30:00"
    },
    "ukončení_časové_platnosti": {
        "datum_a_čas": "2019-01-22T09:30:00"
    },
    "poslední_změna_platnosti": {
		"datum_a_čas": "2019-01-23T09:30:00"
    },
    "časový_interval": [{
        "začátek": {
            "datum_a_čas": "2019-09-24T09:30:00+02:00"
        },
        "konec": {
            "datum_a_čas": "2019-09-28T09:30:00+02:00"
        }
    }, {
        "začátek": {
            "datum_a_čas": "2019-10-24T09:30:00+02:00"
        },
        "konec": {
            "datum_a_čas": "2019-11-28T09:30:00+02:00"
        }
    }],
    "časová_opakovatelnost": [
	"každý rok",
      	"každé století"
    ]
}]